Symbol,Name,Last Sale,Net Change,% Change,Market Cap,Country,IPO Year,Volume,Sector,Industry
KAR,OPENLANE Inc. Common Stock,$21.44,0.03,0.14%,2292167059.00,United States,2009,85154,Consumer Discretionary,Retail-Auto Dealers and Gas Stations
KARO,Karooooo Ltd. Ordinary Shares,$46.58,0.09,0.194%,1439322000.00,Singapore,2021,5237,Technology,Computer Software: Prepackaged Software
KAVL,Kaival Brands Innovations Group Inc. Common Stock,$0.7958,-0.0165,-2.031%,9185364.00,United States,,39686,Consumer Discretionary,Other Consumer Services
KB,KB Financial Group Inc,$56.38,-1.02,-1.777%,21349066454.00,South Korea,,45809,Finance,Commercial Banks
KBDC,Kayne Anderson BDC Inc. Common Stock,$17.43,0.01,0.057%,0.00,,2024,20905,,
KBH,KB Home Common Stock,$61.87,-0.26,-0.418%,4464342515.00,United States,1986,110439,Consumer Discretionary,Homebuilding
KBR,KBR Inc. Common Stock,$48.875,0.995,2.078%,6473086768.00,United States,2006,354354,Industrials,Military/Government/Technical
KBSX,FST Corp. Ordinary Shares,$6.78,0.00,0.00%,48760899.00,Taiwan,,11,Consumer Discretionary,Recreational Games/Products/Toys
KC,Kingsoft Cloud Holdings Limited American Depositary Shares,$17.05,-1.91,-10.074%,4325340384.00,China,2020,2008410,Technology,Computer Software: Prepackaged Software
KD,Kyndryl Holdings Inc. Common Stock,$38.26,-0.21,-0.546%,8902891685.00,United States,2021,366131,Technology,EDP Services
KDLY,Kindly MD Inc. Common Stock,$1.97,0.05,2.604%,11775628.00,United States,2024,40687,Health Care,Medical/Nursing Services
KDLYW,Kindly MD Inc. Warrants,$0.39,0.04,11.429%,2331216.00,United States,2024,44633,Health Care,Medical/Nursing Services
KDP,Keurig Dr Pepper Inc. Common Stock,$33.165,-0.575,-1.704%,44996642836.00,United States,,26676443,Consumer Staples,Beverages (Production/Distribution)
KE,Kimball Electronics Inc. Common Stock,$18.125,-0.275,-1.495%,445053267.00,United States,,11306,Technology,Electrical Products
KELYA,Kelly Services Inc. Class A Common Stock,$13.435,-0.125,-0.922%,468720898.00,United States,,27073,Consumer Discretionary,Professional Services
KELYB,Kelly Services Inc. Class B Common Stock,$13.60,0.00,0.00%,474477426.00,United States,,22,Consumer Discretionary,Professional Services
KEN,Kenon Holdings Ltd. Ordinary Shares,$32.45,0.25,0.776%,1712251670.00,Singapore,2015,2168,Utilities,Electric Utilities: Central
KEP,Korea Electric Power Corporation Common Stock,$8.045,-0.135,-1.65%,10329201999.00,South Korea,1994,26562,Utilities,Electric Utilities: Central
KEQU,Kewaunee Scientific Corporation Common Stock,$54.705,-0.995,-1.786%,157102257.00,United States,,2471,Industrials,Medical Specialities
KEX,Kirby Corporation Common Stock,$102.77,0.66,0.646%,5870839020.00,United States,,53461,Consumer Discretionary,Marine Transportation
KEY,KeyCorp Common Stock,$17.23,0.37,2.195%,19041205849.00,United States,,2814765,Finance,Major Banks
KEY^I,KeyCorp Depositary Shares Each Representing a 1/40th Ownership Interest in a Share of Fixed-to-Floating Rate Perpetual Non-Cumulative Preferred Stock Series E,$25.165,-0.005,-0.02%,,United States,,2541,,
KEY^J,KeyCorp Depositary Shares each representing a 1/40th ownership interest in a share of Fixed Rate Perpetual Non-Cumulative Preferred Stock Series F,$22.81,0.09,0.396%,,United States,,2357,,
KEY^K,KeyCorp Depositary Shares each representing a 1/40th ownership interest in a share of Fixed Rate Perpetual Non-Cumulative Preferred Stock Series G,$22.58,0.08,0.356%,,United States,,781,,
KEY^L,KeyCorp Depositary Shares each representing a 1/40th ownership interest in a share of Fixed Rate Perpetual Non-Cumulative Preferred Stock Series H,$25.0299,-0.0001,0.00%,,United States,,2764,,
KEYS,Keysight Technologies Inc. Common Stock,$163.07,2.71,1.69%,28239282625.00,United States,2014,273356,Industrials,Industrial Machinery/Components
KF,Korea Fund Inc. (The) New Common Stock,$21.01,-0.29,-1.362%,0.00,United States,,506,Finance,Investment Managers
KFFB,Kentucky First Federal Bancorp Common Stock,$3.08,0.00,0.00%,24907082.00,United States,2005,85,Finance,Savings Institutions
KFIIU,K&F Growth Acquisition Corp. II Unit,$10.0111,-0.0089,-0.089%,0.00,United States,2025,158,Finance,Blank Checks
KFRC,Kforce Inc. Common Stock,$49.205,-0.325,-0.656%,940356755.00,United States,1995,7111,Consumer Discretionary,Professional Services
KFS,Kingsway Financial Services Inc. Common Stock (DE),$7.7521,-0.0279,-0.359%,213747033.00,Canada,,663,Finance,Property-Casualty Insurers
KFY,Korn Ferry Common Stock,$64.44,-0.50,-0.77%,3324009229.00,United States,1999,41950,Consumer Discretionary,Diversified Commercial Services
KGC,Kinross Gold Corporation Common Stock,$10.85,-0.23,-2.076%,13334650000.00,Canada,2001,3840240,Basic Materials,Precious Metals
KGEI,Kolibri Global Energy Inc. Common stock,$7.67,0.19,2.54%,274094852.00,United States,,17444,Energy,Oil & Gas Production
KGS,Kodiak Gas Services Inc. Common Stock,$43.32,0.32,0.744%,3793518494.00,United States,2023,108899,Utilities,Natural Gas Distribution
KHC,The Kraft Heinz Company Common Stock,$30.65,0.03,0.098%,36626442059.00,United States,,3375372,Consumer Staples,Packaged Foods
KIDS,OrthoPediatrics Corp. Common Stock,$22.90,-0.10,-0.435%,554544934.00,United States,2017,6751,Health Care,Medical/Dental Instruments
KIM,Kimco Realty Corporation (HC) Common Stock,$21.845,0.165,0.761%,14843285033.00,United States,,937367,Real Estate,Real Estate Investment Trusts
KIM^L,Kimco Realty Corporation Class L Depositary Shares each of which represents a one-one thousandth fractional interest in a share of 5.125% Class L Cumulative Redeemable Preferred Stock liquidation preference $25000.00 per share,$21.16,0.00,0.00%,,United States,,263,,
KIM^M,Kimco Realty Corporation Class M Depositary Shares each of which represents a one-one thousandth fractional interest in a share of 5.25% Class M Cumulative Redeemable Preferred Stock liquidation preference $25000.00 per share,$21.76,-0.05,-0.229%,,United States,,1368,,
KIM^N,Kimco Realty Corporation Depositary Shares each representing 1/1000th interest in a share of 7.25% Class N Cumulative Convertible Perpetual Preferred Stock,$60.57,0.02,0.033%,,United States,,1171,,
KIND,Nextdoor Holdings Inc. Class A Common Stock,$2.49,-0.06,-2.353%,951536349.00,United States,,283603,Technology,Computer Software: Programming Data Processing
KINS,Kingstone Companies Inc. Common Stock,$15.62,0.35,2.292%,192893442.00,United States,,40586,Finance,Property-Casualty Insurers
KIO,KKR Income Opportunities Fund Common Shares,$12.545,-0.015,-0.119%,0.00,United States,2013,79242,Finance,Investment Managers
KIRK,Kirkland's Inc. COMMONSTOCK,$1.4299,0.0099,0.697%,18757345.00,United States,2002,35227,Consumer Discretionary,Other Specialty Stores
KITT,Nauticus Robotics Inc. Common stock,$1.06,-0.04,-3.636%,6791924.00,United States,2021,470297,Industrials,Industrial Machinery/Components
KITTW,Nauticus Robotics Inc. Warrant,$0.0625,-0.0023,-3.549%,400467.00,United States,2021,74746,Industrials,Industrial Machinery/Components
KKR,KKR & Co. Inc. Common Stock,$134.575,1.895,1.428%,119533405429.00,United States,,1496767,Finance,Investment Managers
KKRS,KKR Group Finance Co. IX LLC 4.625% Subordinated Notes due 2061,$19.06,0.00,0.00%,16929643006.00,United States,2021,627,,
KLAC,KLA Corporation Common Stock,$731.62,-6.90,-0.934%,97222601109.00,United States,1980,177706,Technology,Electronic Components
KLC,KinderCare Learning Companies Inc. Common Stock,$20.01,0.11,0.553%,2360501441.00,,2024,16182,Consumer Discretionary,Other Consumer Services
KLG,WK Kellogg Co Common Stock,$20.13,0.20,1.004%,1735144785.00,United States,2023,255030,Consumer Staples,Packaged Foods
KLIC,Kulicke and Soffa Industries Inc. Common Stock,$39.27,-1.04,-2.58%,2096357007.00,Singapore,,119264,Technology,Semiconductors
KLTO,Klotho Neurosciences Inc. Common Stock,$0.301,-0.061,-16.851%,6400318.00,United States,2022,10089257,Health Care,Biotechnology: Biological Products (No Diagnostic Substances)
KLTOW,Klotho Neurosciences Inc. Warrant,$0.0251,-0.0124,-33.067%,533714.00,United States,2022,9354,Health Care,Biotechnology: Biological Products (No Diagnostic Substances)
KLTR,Kaltura Inc. Common Stock,$2.14,-0.03,-1.382%,329855894.00,United States,2021,39791,Technology,Computer Software: Prepackaged Software
KLXE,KLX Energy Services Holdings Inc. Common Stock,$4.02,-0.085,-2.071%,67778551.00,United States,,45001,Energy,Oilfield Services/Equipment
KMB,Kimberly-Clark Corporation Common Stock,$140.25,1.09,0.783%,46518765290.00,United States,,482527,Consumer Discretionary,Containers/Packaging
KMDA,Kamada Ltd. Ordinary Shares,$7.115,0.015,0.211%,319036600.00,Israel,2013,19172,Health Care,Biotechnology: Pharmaceutical Preparations
KMI,Kinder Morgan Inc. Common Stock,$26.355,0.185,0.707%,58559835524.00,United States,2011,2502731,Utilities,Natural Gas Distribution
KMPB,Kemper Corporation 5.875% Fixed-Rate Reset Junior Subordinated Debentures due 2062,$23.73,0.08,0.338%,1516360218.00,United States,2022,3109,Finance,Property-Casualty Insurers
KMPR,Kemper Corporation,$66.08,1.13,1.74%,4222548807.00,United States,,18221,Finance,Property-Casualty Insurers
KMT,Kennametal Inc. Common Stock,$22.02,-0.26,-1.167%,1703474401.00,United States,,160016,Industrials,Industrial Machinery/Components
KMX,CarMax Inc,$82.725,0.205,0.248%,12723102849.00,United States,,142894,Consumer Discretionary,Retail-Auto Dealers and Gas Stations
KN,Knowles Corporation Common Stock,$16.99,-0.04,-0.235%,1489397309.00,United States,2014,107426,Consumer Staples,Consumer Electronics/Appliances
KNDI,Kandi Technologies Group Inc. Ordinary Shares,$1.54,-0.02,-1.282%,134531680.00,China,,72735,Consumer Discretionary,Auto Manufacturing
KNF,Knife Riv Holding Co. Common Stock,$95.17,-0.83,-0.865%,5387831135.00,United States,2023,67453,Industrials,Mining & Quarrying of Nonmetallic Minerals (No Fuels)
KNOP,KNOT Offshore Partners LP Common Units representing Limited Partner Interests,$5.365,0.035,0.657%,182651860.00,United Kingdom,2013,2225,Consumer Discretionary,Marine Transportation
KNSA,Kiniksa Pharmaceuticals International plc Class A Ordinary Shares,$19.65,-0.04,-0.203%,1427459316.00,United States,2018,56148,Health Care,Biotechnology: Pharmaceutical Preparations
KNSL,Kinsale Capital Group Inc. Common Stock,$428.01,11.17,2.68%,9962957834.00,United States,,31153,Finance,Property-Casualty Insurers
KNTK,Kinetik Holdings Inc. Class A Common Stock,$55.40,-3.03,-5.186%,8727566808.00,United States,2022,935599,Utilities,Natural Gas Distribution
KNX,Knight-Swift Transportation Holdings Inc.,$49.63,-0.21,-0.421%,8038850666.00,United States,2017,178027,Industrials,Trucking Freight/Courier Services
KO,Coca-Cola Company (The) Common Stock,$71.325,0.525,0.742%,306768853173.00,United States,,3699549,Consumer Staples,Beverages (Production/Distribution)
KOD,Kodiak Sciences Inc Common Stock,$4.23,0.09,2.174%,222598564.00,United States,2018,31959,Health Care,Biotechnology: Biological Products (No Diagnostic Substances)
KODK,Eastman Kodak Company Common New,$7.115,-0.035,-0.49%,572046000.00,United States,,145723,Consumer Discretionary,Industrial Machinery/Components
KOF,Coca Cola Femsa S.A.B. de C.V.  American Depositary Shares each representing 10 Units (each Unit consists of 3 Series B Shares and 5 Series L Shares),$88.45,1.86,2.148%,18581861340.00,Mexico,1993,50044,Consumer Staples,Beverages (Production/Distribution)
KOP,Koppers Holdings Inc. Common Stock,$27.585,-4.685,-14.518%,559118351.00,United States,2006,152668,Basic Materials,Forest Products
KOPN,Kopin Corporation Common Stock,$1.355,-0.055,-3.901%,215174813.00,United States,1992,1093846,Technology,Semiconductors
KORE,KORE Group Holdings Inc. Common Stock,$2.32,0.002,0.086%,39459386.00,United States,,1459,Telecommunications,Telecommunications Equipment
KOS,Kosmos Energy Ltd. Common Shares (DE),$2.665,0.015,0.566%,1273615898.00,Bermuda,2011,1393983,Energy,Oil & Gas Production
KOSS,Koss Corporation Common Stock,$5.65,-0.15,-2.586%,52973242.00,United States,,13307,Consumer Staples,Consumer Electronics/Appliances
KPLT,Katapult Holdings Inc. Common Stock,$10.89,0.71,6.974%,47812752.00,United States,2019,4749,Consumer Discretionary,Diversified Commercial Services
KPLTW,Katapult Holdings Inc. Warrant,$0.013,0.004,44.444%,57077.00,United States,2019,67610,Consumer Discretionary,Diversified Commercial Services
KPRX,Kiora Pharmaceuticals Inc.  Common Stock,$3.3438,-0.0362,-1.071%,10034035.00,United States,,2173,Health Care,Biotechnology: Pharmaceutical Preparations
KPTI,Karyopharm Therapeutics Inc. Common Stock,$9.935,0.105,1.068%,83613000.00,United States,2013,74789,Health Care,Biotechnology: Pharmaceutical Preparations
KR,Kroger Company (The) Common Stock,$64.09,0.29,0.455%,46375916872.00,United States,,961916,Consumer Staples,Food Chains
KRC,Kilroy Realty Corporation Common Stock,$35.96,1.42,4.111%,4248194869.00,United States,1997,224016,Real Estate,Real Estate Investment Trusts
KREF,KKR Real Estate Finance Trust Inc. Common Stock,$11.19,-0.01,-0.089%,768905139.00,United States,2017,31227,Real Estate,Real Estate Investment Trusts
KREF^A,KKR Real Estate Finance Trust Inc. 6.50% Series A Cumulative Redeemable Preferred Stock,$20.00,-0.12,-0.596%,,United States,,1456,,
KRG,Kite Realty Group Trust Common Stock,$22.47,0.27,1.216%,4935862820.00,United States,2004,70395,Real Estate,Real Estate Investment Trusts
KRKR,36Kr Holdings Inc. American Depositary Shares,$4.34,-0.18,-3.982%,8464237.00,China,2019,7031,Consumer Discretionary,Business Services
KRMD,KORU Medical Systems Inc. Common Stock (DE),$3.5055,-0.0745,-2.081%,160682669.00,United States,,27507,Health Care,Medical/Dental Instruments
KRMN,Karman Holdings Inc. Common Stock,$29.90,-0.24,-0.796%,3952020331.00,,2025,140999,Industrials,Military/Government/Technical
KRNT,Kornit Digital Ltd. Ordinary Shares,$25.55,0.60,2.405%,1219236623.00,Israel,2015,43324,Industrials,Industrial Machinery/Components
KRNY,Kearny Financial Corp Common Stock,$6.81,0.00,0.00%,439787641.00,United States,2005,26078,Finance,Savings Institutions
KRO,Kronos Worldwide Inc Common Stock,$8.93,0.01,0.112%,1027274302.00,United States,,17053,Industrials,Major Chemicals
KRON,Kronos Bio Inc. Common Stock,$0.99,0.0149,1.528%,59737509.00,United States,2020,10877,Health Care,Biotechnology: Pharmaceutical Preparations
KROS,Keros Therapeutics Inc. Common Stock,$11.30,0.36,3.291%,457733722.00,United States,2020,213522,Health Care,Biotechnology: Pharmaceutical Preparations
KRP,Kimbell Royalty Partners Common Units Representing Limited Partner Interests,$15.125,-0.495,-3.169%,1444343286.00,United States,2017,493366,Energy,Oil & Gas Production
KRRO,Korro Bio Inc. Common Stock,$25.63,0.01,0.039%,240108555.00,United States,2019,5252,Health Care,Biotechnology: Pharmaceutical Preparations
KRT,Karat Packaging Inc. Common Stock,$30.10,-0.42,-1.376%,602725561.00,United States,2021,8197,Industrials,Plastic Products
KRUS,Kura Sushi USA Inc. Class A Common Stock,$65.70,0.06,0.091%,792744872.00,United States,2019,42367,Consumer Discretionary,Restaurants
KRYS,Krystal Biotech Inc. Common Stock,$178.895,2.505,1.42%,5153263324.00,United States,2017,31177,Health Care,Biotechnology: Biological Products (No Diagnostic Substances)
KSCP,Knightscope Inc. Class A Common Stock,$6.7098,-0.0902,-1.326%,25621036.00,United States,2022,29380,Telecommunications,Telecommunications Equipment
KSPI,Joint Stock Company Kaspi.kz American Depository Shares,$103.30,-0.03,-0.029%,19558146935.00,Kazakhstan,2024,221987,,
KSS,Kohl's Corporation Common Stock,$11.765,-0.185,-1.548%,1309650435.00,United States,1992,1738356,Consumer Discretionary,Department/Specialty Retail Stores
KT,KT Corporation Common Stock,$17.575,-0.105,-0.594%,8661431783.00,South Korea,,224989,Telecommunications,Telecommunications Equipment
KTB,Kontoor Brands Inc. Common Stock ,$68.06,-0.43,-0.628%,3765490827.00,United States,2019,166928,Consumer Discretionary,Apparel
KTCC,Key Tronic Corporation Common Stock,$3.10,0.00,0.00%,33361800.00,United States,1983,9,Technology,Electrical Products
KTF,DWS Municipal Income Trust,$9.745,0.035,0.36%,384936641.00,United States,1988,17001,Finance,Finance Companies
KTH,Structures Products Cp 8% CorTS Issued by Peco Energy Cap Tr II Preferred Stock,$28.99,0.00,0.00%,0.00,United States,,35,Finance,Finance: Consumer Services
KTN,Structured Products Corp 8.205% CorTS 8.205% Corporate Backed Trust Securities (CorTS),$26.33,0.00,0.00%,0.00,United States,,100,Finance,Finance: Consumer Services
KTOS,Kratos Defense & Security Solutions Inc. Common Stock,$25.755,0.795,3.185%,3890907934.00,United States,,889338,Industrials,Military/Government/Technical
KTTA,Pasithea Therapeutics Corp. Common Stock,$1.2677,-0.0223,-1.729%,1605450.00,United States,2021,10086,Health Care,Biotechnology: Pharmaceutical Preparations
KTTAW,Pasithea Therapeutics Corp. Warrant,$0.0288,0.004,16.129%,36473.00,United States,2021,4000,Health Care,Biotechnology: Pharmaceutical Preparations
KUKE,Kuke Music Holding Limited American Depositary Shares each representing one Ordinary Share,$0.2838,-0.0016,-0.561%,9436839.00,,2021,93553,Real Estate,Other Consumer Services
KULR,KULR Technology Group Inc. Common Stock,$1.496,0.016,1.081%,320484801.00,United States,,3199255,Technology,Electrical Products
KURA,Kura Oncology Inc. Common Stock,$7.84,0.07,0.901%,609667800.00,United States,,247747,Health Care,Biotechnology: Pharmaceutical Preparations
KVAC,Keen Vision Acquisition Corporation Ordinary Shares,$11.15,0.01,0.09%,0.00,United States,2023,102,,
KVACU,Keen Vision Acquisition Corporation Units,$11.30,0.12,1.073%,0.00,United States,2023,100,,
KVHI,KVH Industries Inc. Common Stock,$5.92,0.04,0.68%,117210802.00,United States,1996,626,Technology,Radio And Television Broadcasting And Communications Equipment
KVUE,Kenvue Inc. Common Stock,$22.91,-0.31,-1.335%,43786524895.00,United States,2023,3351382,Consumer Discretionary,Specialty Chemicals
KVYO,Klaviyo Inc. Series A Common Stock,$40.56,0.06,0.148%,11077547483.00,United States,2023,65031,Technology,Computer Software: Prepackaged Software
KW,Kennedy-Wilson Holdings Inc. Common Stock,$9.905,0.735,8.015%,1361065097.00,United States,,182240,Finance,Real Estate
KWE,KWESST Micro Systems Inc. Common Stock,$0.475,0.005,1.064%,3746431.00,Canada,,240658,Technology,Computer Software: Prepackaged Software
KWESW,KWESST Micro Systems Inc. Warrant,$0.0444,0.0053,13.555%,350193.00,Canada,,1120,Technology,Computer Software: Prepackaged Software
KWR,Quaker Houghton Common Stock,$139.77,1.69,1.224%,2469967080.00,United States,,7533,Industrials,Major Chemicals
KXIN,Kaixin Holdings Ordinary Shares,$1.23,-0.02,-1.60%,1213500.00,China,2017,74398,Consumer Discretionary,Retail-Auto Dealers and Gas Stations
KYMR,Kymera Therapeutics Inc. Common Stock,$33.525,-1.835,-5.189%,2171255811.00,United States,2020,213652,Health Care,Biotechnology: Biological Products (No Diagnostic Substances)
KYN,Kayne Anderson Energy Infrastructure Fund Inc.,$12.63,0.07,0.557%,1719341224.00,United States,2004,42210,Finance,Finance/Investors Services
KYTX,Kyverna Therapeutics Inc. Common Stock,$2.81,-0.01,-0.355%,121312230.00,United States,2024,13867,Health Care,Biotechnology: Biological Products (No Diagnostic Substances)
KZIA,Kazia Therapeutics Limited American Depositary Shares,$0.8314,-0.0353,-4.073%,2767322.00,Australia,,26121,Health Care,Biotechnology: Pharmaceutical Preparations
KZR,Kezar Life Sciences Inc. Common Stock,$6.19,0.13,2.145%,45163614.00,United States,2018,19563,Health Care,Biotechnology: Pharmaceutical Preparations
L,Loews Corporation Common Stock,$85.48,1.28,1.52%,18195383924.00,United States,,53553,Finance,Property-Casualty Insurers
LAB,Standard BioTools Inc. Common Stock,$1.165,-0.005,-0.427%,433681500.00,United States,2011,2008088,Industrials,Biotechnology: Laboratory Analytical Instruments
LAC,Lithium Americas Corp. Common Shares,$2.825,0.015,0.534%,616680550.00,Canada,2023,797471,Basic Materials,Metal Mining
LAD,Lithia Motors Inc. Common Stock,$344.51,-0.74,-0.214%,9056046864.00,United States,,13889,Consumer Discretionary,Retail-Auto Dealers and Gas Stations
LADR,Ladder Capital Corp Class A Common Stock,$11.68,0.02,0.172%,1484603698.00,United States,2014,39612,Real Estate,Real Estate Investment Trusts
LAES,SEALSQ Corp Ordinary Shares,$3.185,0.095,3.074%,74465300.00,Switzerland,,6259494,Technology,Semiconductors
LAKE,Lakeland Industries Inc. Common Stock,$23.70,0.25,1.066%,175512815.00,United States,1986,7244,Health Care,Industrial Specialties
LAMR,Lamar Advertising Company Class A Common Stock,$123.85,1.26,1.028%,12681869441.00,United States,1996,29886,Real Estate,Real Estate Investment Trusts
LANC,Lancaster Colony Corporation Common Stock,$191.15,0.66,0.346%,5270387800.00,United States,,14452,Consumer Staples,Packaged Foods
LAND,Gladstone Land Corporation Common Stock,$11.4336,0.1036,0.914%,413720906.00,United States,2013,66851,Real Estate,Real Estate Investment Trusts
LANDM,Gladstone Land Corporation 5.00% Series D Cumulative Term Preferred Stock,$24.75,-0.0511,-0.206%,895570286.00,United States,,3697,Real Estate,Real Estate Investment Trusts
LANDO,Gladstone Land Corporation 6.00% Series B Cumulative Redeemable Preferred Stock,$20.6799,0.2199,1.075%,748295109.00,United States,,4519,Real Estate,Real Estate Investment Trusts
LANDP,Gladstone Land Corporation 6.00% Series C Cumulative Redeemable Preferred Stock,$20.43,0.23,1.139%,739252563.00,United States,,9358,Real Estate,Real Estate Investment Trusts
LANV,Lanvin Group Holdings Limited Ordinary Shares,$1.91,0.00,0.00%,250154744.00,Cayman Islands,2022,39,Finance,Blank Checks
LAR,Lithium Argentina AG Common Shares,$2.33,0.01,0.431%,375829000.00,Canada,2023,201351,Basic Materials,Metal Mining
LARK,Landmark Bancorp Inc. Common Stock,$23.69,0.00,0.00%,136840121.00,United States,,109,Finance,Major Banks
LASE,Laser Photonics Corporation Common Stock,$3.46,-0.04,-1.143%,47860087.00,United States,2022,36901,Miscellaneous,Industrial Machinery/Components
LASR,nLIGHT Inc. Common Stock,$9.54,-0.29,-2.95%,462016056.00,United States,2018,48071,Technology,Semiconductors
LAUR,Laureate Education Inc. Common Stock,$19.85,0.15,0.761%,2993079213.00,United States,2017,115143,Real Estate,Other Consumer Services
LAW,CS Disco Inc. Common Stock,$4.9662,-0.0538,-1.072%,299876265.00,United States,2021,6436,Technology,Computer Software: Prepackaged Software
LAZ,Lazard Inc. Common Stock,$49.96,0.38,0.766%,5633793906.00,Bermuda,2005,139105,Finance,Investment Managers
LAZR,Luminar Technologies Inc.  Class A Common Stock,$5.53,0.215,4.045%,184127499.00,United States,2019,283160,Consumer Discretionary,Auto Parts:O.E.M.
LB,LandBridge Company LLC Class A Shares Representing Limited Liability Company Interests,$65.145,0.405,0.626%,4765461177.00,,2024,51813,Energy,Oil & Gas Production
LBGJ,Li Bang International Corporation Inc. Ordinary Shares,$1.7809,0.3609,25.415%,32982268.00,China,2024,65126,,
LBRDA,Liberty Broadband Corporation Class A Common Stock,$79.70,0.95,1.206%,11384993092.00,United States,,10093,Telecommunications,Cable & Other Pay Television Services
LBRDK,Liberty Broadband Corporation Class C Common Stock,$80.70,1.21,1.522%,11527841186.00,United States,,74370,Telecommunications,Cable & Other Pay Television Services
LBRDP,Liberty Broadband Corporation Series A Cumulative Redeemable Preferred Stock,$25.00,0.00,0.00%,3571202350.00,United States,,63,Telecommunications,Cable & Other Pay Television Services
LBRT,Liberty Energy Inc. Class A common stock,$17.68,0.46,2.671%,2862812908.00,United States,2018,449020,Energy,Oilfield Services/Equipment
LBTYA,Liberty Global Ltd. Class A Common Shares,$11.705,0.005,0.043%,4082173330.00,United Kingdom,,267972,Telecommunications,Cable & Other Pay Television Services
LBTYB,Liberty Global Ltd. Class B Common Shares,$11.11,0.00,0.00%,3874664306.00,United Kingdom,,1,Telecommunications,Cable & Other Pay Television Services
LBTYK,Liberty Global Ltd. Class C Common Shares,$12.20,0.01,0.082%,4254806889.00,United Kingdom,,340206,Telecommunications,Cable & Other Pay Television Services
LC,LendingClub Corporation Common Stock,$12.78,0.14,1.108%,1449046459.00,United States,2014,259315,Finance,Finance: Consumer Services
LCFY,Locafy Limited Ordinary Share,$6.80,-0.18,-2.579%,9398858.00,Australia,2022,759,Technology,Computer Software: Programming Data Processing
LCFYW,Locafy Limited Warrant,$12.00,2.89,31.723%,16586220.00,Australia,2022,2417,Technology,Computer Software: Programming Data Processing
LCID,Lucid Group Inc. Common Stock,$2.397,0.142,6.297%,7266505143.00,United States,,46716864,Consumer Discretionary,Auto Manufacturing
LCII,LCI Industries,$104.83,-0.13,-0.124%,2669310086.00,United States,1995,22398,Consumer Discretionary,Auto Parts:O.E.M.
LCNB,LCNB Corporation Common Stock,$14.76,-0.20,-1.337%,208268574.00,United States,,291,Finance,Major Banks
LCTX,Lineage Cell Therapeutics Inc. Common Stock,$0.62,-0.0065,-1.038%,117079173.00,United States,,350931,Health Care,Biotechnology: Biological Products (No Diagnostic Substances)
LCUT,Lifetime Brands Inc. Common Stock,$5.11,-0.15,-2.852%,113220916.00,United States,1991,3943,Consumer Discretionary,Industrial Machinery/Components
LDI,loanDepot Inc. Class A Common Stock,$1.645,0.045,2.813%,537916050.00,United States,2021,227473,Finance,Finance: Consumer Services
LDOS,Leidos Holdings Inc. Common Stock,$130.14,0.55,0.424%,17070121792.00,United States,,111671,Technology,EDP Services
LDP,Cohen & Steers Limited Duration Preferred and Income Fund Inc.,$20.8156,-0.1044,-0.499%,0.00,United States,2012,11469,Finance,Finance Companies
LDTC,LeddarTech Holdings Inc. Common Shares,$0.565,-0.0349,-5.818%,17065077.00,United States,2021,15431,Technology,Computer Software: Prepackaged Software
