Symbol,Name,Last Sale,Net Change,% Change,Market Cap,Country,IPO Year,Volume,Sector,Industry
DHIL,Diamond Hill Investment Group Inc. Class A Common Stock,$144.995,-0.975,-0.668%,394742508.00,United States,,4712,Finance,Investment Managers
DHR,Danaher Corporation Common Stock,$208.04,-1.40,-0.668%,148688237610.00,United States,,1435348,Industrials,Industrial Machinery/Components
DHT,DHT Holdings Inc.,$10.36,-0.30,-2.814%,1667955255.00,Jersey,2005,501283,Consumer Discretionary,Marine Transportation
DHX,DHI Group Inc. Common Stock,$2.38,0.03,1.277%,116435005.00,United States,2007,13611,Consumer Discretionary,Business Services
DHY,Credit Suisse High Yield Bond Fund Common Stock,$2.165,-0.005,-0.23%,0.00,United States,1998,30368,Finance,Finance/Investors Services
DIAX,Nuveen Dow 30SM Dynamic Overwrite Fund Common Shares of Beneficial Interest,$15.1953,0.0353,0.233%,0.00,,2014,7633,Finance,Finance Companies
DIBS,1stdibs.com Inc. Common Stock,$3.825,0.025,0.658%,139662378.00,United States,2021,43264,Consumer Discretionary,Catalog/Specialty Distribution
DIN,Dine Brands Global Inc. Common Stock,$25.8988,0.3488,1.365%,394865355.00,United States,,60356,Consumer Discretionary,Restaurants
DINO,HF Sinclair Corporation Common Stock,$35.205,0.715,2.073%,6632880510.00,United States,1960,607847,Energy,Natural Gas Distribution
DIOD,Diodes Incorporated Common Stock,$52.7932,-0.9968,-1.853%,2446116433.00,United States,,47812,Technology,Semiconductors
DIS,Walt Disney Company (The) Common Stock,$112.3708,0.5408,0.484%,203142680991.00,United States,,1063113,Consumer Discretionary,Services-Misc. Amusement & Recreation
DIST,Distoken Acquisition Corporation Ordinary Shares,$11.1101,0.00,0.00%,0.00,China,2023,52,Finance,Blank Checks
DISTW,Distoken Acquisition Corporation Warrant,$0.0249,0.00,0.00%,0.00,China,2023,1,Finance,Blank Checks
DIT,AMCON Distributing Company Common Stock,$137.96,3.95,2.948%,89047938.00,United States,1999,337,Consumer Discretionary,Food Distributors
DJCO,Daily Journal Corp. (S.C.) Common Stock,$390.80,-2.60,-0.661%,538298081.00,United States,,2133,Consumer Discretionary,Newspapers/Magazines
DJT,Trump Media & Technology Group Corp. Common Stock,$24.62,0.10,0.408%,5418009286.00,United States,2024,976702,Technology,Computer Software: Programming Data Processing
DJTWW,Trump Media & Technology Group Corp. Warrants,$15.115,0.105,0.70%,3326287992.00,United States,2021,19884,Technology,Computer Software: Programming Data Processing
DK,Delek US Holdings Inc. Common Stock,$15.84,0.72,4.762%,1001011414.00,United States,2017,412668,Energy,Integrated oil Companies
DKL,Delek Logistics Partners L.P. Common Units representing Limited Partner Interests,$42.19,0.51,1.224%,2171378554.00,United States,2012,30208,Energy,Natural Gas Distribution
DKNG,DraftKings Inc. Class A Common Stock,$43.87,0.51,1.176%,21494379415.00,United States,2019,2148139,Consumer Discretionary,Services-Misc. Amusement & Recreation
DKS,Dick's Sporting Goods Inc Common Stock,$224.44,-2.46,-1.084%,18286161244.00,United States,2002,117598,Consumer Discretionary,Other Specialty Stores
DLB,Dolby Laboratories Common Stock,$81.88,0.29,0.355%,7891355065.00,United States,2005,66344,Miscellaneous,Multi-Sector Companies
DLHC,DLH Holdings Corp.,$5.23,0.08,1.553%,75241228.00,United States,,3218,Consumer Discretionary,Professional Services
DLNG,Dynagas LNG Partners LP Common Units,$3.87,0.00,0.00%,142562182.00,Greece,,13950,Consumer Discretionary,Marine Transportation
DLNG^A,Dynagas LNG Partners LP 9.00% Series A Cumulative Redeemable Preferred Units,$24.7899,-0.1009,-0.405%,,Greece,,2702,,
DLNG^B,Dynagas LNG Partners LP 8.75% Series B Fixed to Floating Rate Cumulative Redeemable Perpetual Preferred Units liquidation preference $25.00 per Uni,$25.49,0.14,0.552%,,Greece,,377,,
DLO,DLocal Limited Class A Common Shares,$14.02,0.02,0.143%,4149803143.00,Uruguay,2021,382595,Consumer Discretionary,Business Services
DLPN,Dolphin Entertainment Inc. Common Stock,$1.10,-0.02,-1.786%,12278229.00,United States,,5234,Consumer Discretionary,Other Consumer Services
DLR,Digital Realty Trust Inc. Common Stock,$159.32,-0.06,-0.038%,53634161113.00,United States,2004,428646,Real Estate,Real Estate Investment Trusts
DLR^J,Digital Realty Trust Inc. 5.250% Series J Cumulative Redeemable Preferred Stock,$21.89,-0.02,-0.091%,,United States,,1435,,
DLR^K,Digital Realty Trust Inc. 5.850% Series K Cumulative Redeemable Preferred Stock par value $0.01 per share,$24.46,0.07,0.287%,,United States,,112,,
DLR^L,Digital Realty Trust Inc. 5.200% Series L Cumulative Redeemable Preferred Stock,$21.30,0.02,0.094%,,United States,,1595,,
DLTH,Duluth Holdings Inc. Class B Common Stock,$2.75,-0.01,-0.362%,96737174.00,United States,2015,6682,Consumer Discretionary,Clothing/Shoe/Accessory Stores
DLTR,Dollar Tree Inc. Common Stock,$72.965,-1.175,-1.585%,15690294222.00,United States,1995,639656,Consumer Discretionary,Department/Specialty Retail Stores
DLX,Deluxe Corporation Common Stock,$16.14,-0.15,-0.921%,717113160.00,United States,,54182,Consumer Discretionary,Publishing
DLY,DoubleLine Yield Opportunities Fund Common Shares of Beneficial Interest,$16.2728,0.0278,0.171%,780212073.00,United States,2020,30086,Finance,Investment Managers
DM,Desktop Metal Inc. Class A Common Stock,$2.27,0.04,1.794%,75685021.00,United States,2019,99284,Technology,Industrial Machinery/Components
DMA,Destra Multi-Alternative Fund Common Stock,$8.74,0.03,0.344%,0.00,,2022,2568,Finance,Trusts Except Educational Religious and Charitable
DMAA,Drugs Made In America Acquisition Corp. Ordinary Shares,$9.97,0.00,0.00%,0.00,United States,2025,202,,
DMAAR,Drugs Made In America Acquisition Corp. Rights,$0.1545,0.0045,3.00%,0.00,United States,2025,765,Finance,Blank Checks
DMAAU,Drugs Made In America Acquisition Corp. Units,$10.11,0.0001,0.001%,0.00,United States,2025,149952,,
DMAC,DiaMedica Therapeutics Inc. Common Stock,$6.2895,0.0395,0.632%,268942680.00,United States,2018,6929,Health Care,Biotechnology: Pharmaceutical Preparations
DMB,BNY Mellon Municipal Bond Infrastructure Fund Inc. Common Stock,$10.84,0.03,0.278%,0.00,,2013,999,Finance,Trusts Except Educational Religious and Charitable
DMF,BNY Mellon Municipal Income Inc. Common Stock,$7.19,0.00,0.00%,447871240.00,United States,1988,5305,Finance,Finance/Investors Services
DMLP,Dorchester Minerals L.P. Common Units Representing Limited Partnership Interests,$30.80,-0.20,-0.645%,1458064485.00,United States,,17433,Energy,Oil & Gas Production
DMN,Damon Inc. Common Stock,$0.2398,0.0218,10.00%,5283006.00,United Kingdom,,1905535,Technology,EDP Services
DMO,Western Asset Mortgage Opportunity Fund Inc. Common Stock,$11.90,0.01,0.084%,0.00,United States,2010,25718,Finance,Trusts Except Educational Religious and Charitable
DMRC,Digimarc Corporation Common Stock,$18.165,-8.875,-32.822%,389672020.00,United States,,687321,Technology,EDP Services
DMYY,dMY Squared Technology Group Inc. Class A Common Stock,$11.45,-0.06,-0.521%,0.00,,2022,101262,Finance,Blank Checks
DNA,Ginkgo Bioworks Holdings Inc. Class A Common Stock,$9.295,0.185,2.031%,539422312.00,United States,2021,543346,Health Care,Biotechnology: Biological Products (No Diagnostic Substances)
DNB,Dun & Bradstreet Holdings Inc. Common Stock,$9.16,0.09,0.992%,4044289940.00,United States,2020,761314,Finance,Finance: Consumer Services
DNLI,Denali Therapeutics Inc. Common Stock,$18.97,0.08,0.424%,2730193207.00,United States,2017,127600,Health Care,Biotechnology: Biological Products (No Diagnostic Substances)
DNN,Denison Mines Corp Ordinary Shares (Canada),$1.535,0.035,2.333%,1369787847.00,Canada,,17182643,Basic Materials,Other Metals and Minerals
DNOW,DNOW Inc. Common Stock,$16.22,0.10,0.62%,1714249790.00,United States,2014,65008,Industrials,Metal Fabrications
DNP,DNP Select Income Fund Inc. Common Stock,$9.505,0.005,0.053%,0.00,United States,1987,225090,Finance,Investment Managers
DNTH,Dianthus Therapeutics Inc. Common Stock,$21.39,0.78,3.785%,633079081.00,United States,2018,9186,Health Care,Biotechnology: Pharmaceutical Preparations
DNUT,Krispy Kreme Inc. Common Stock,$6.32,0.355,5.951%,1074400000.00,United States,2021,2937389,Consumer Staples,Food Chains
DOC,Healthpeak Properties Inc. Common Stock,$20.175,0.155,0.774%,14113716551.00,United States,,331300,Real Estate,Real Estate Investment Trusts
DOCN,DigitalOcean Holdings Inc. Common Stock,$45.28,1.34,3.05%,4168829939.00,United States,2021,529109,Technology,Computer Software: Programming Data Processing
DOCS,Doximity Inc. Class A Common Stock,$72.29,-0.61,-0.837%,13564286393.00,United States,2021,413895,Technology,EDP Services
DOCU,DocuSign Inc. Common Stock,$83.98,1.70,2.066%,16965903381.00,United States,1989,877260,Technology,Computer Software: Prepackaged Software
DOGZ,Dogness (International) Corporation Class A Common Stock,$26.68,0.18,0.679%,339653955.00,China,2017,108162,Consumer Discretionary,Miscellaneous manufacturing industries
DOLE,Dole plc Ordinary Shares,$14.52,-0.17,-1.157%,1378371679.00,Ireland,2021,73917,Consumer Staples,Farming/Seeds/Milling
DOMH,Dominari Holdings Inc. Common Stock,$8.30,-0.02,-0.24%,52091945.00,United States,,238609,Health Care,Biotechnology: Pharmaceutical Preparations
DOMO,Domo Inc. Class B Common Stock,$7.88,0.05,0.639%,308167691.00,United States,2018,37920,Technology,Computer Software: Prepackaged Software
DOOO,BRP Inc. (Recreational Products) Common Subordinate Voting Shares,$40.13,-0.27,-0.668%,2929897600.00,Canada,,25174,Consumer Discretionary,Industrial Specialties
DORM,Dorman Products Inc. Common Stock,$128.23,4.22,3.403%,3913256973.00,United States,,46994,Consumer Discretionary,Auto Parts:O.E.M.
DOUG,Douglas Elliman Inc. Common Stock,$1.93,-0.01,-0.515%,172092293.00,United States,2021,37281,Finance,Real Estate
DOV,Dover Corporation Common Stock,$198.58,0.90,0.455%,27250221719.00,United States,,56920,Industrials,Industrial Machinery/Components
DOW,Dow Inc. Common Stock ,$38.62,-0.23,-0.592%,27181989175.00,United States,2019,1495333,Industrials,Major Chemicals
DOX,Amdocs Limited Ordinary Shares,$88.78,0.86,0.978%,10022424272.00,Guernsey,,112932,Technology,EDP Services
DOYU,DouYu International Holdings Limited ADS,$7.425,0.045,0.61%,234894137.00,China,2019,82773,Technology,Computer Software: Programming Data Processing
DPG,Duff & Phelps Utility and Infrastructure Fund Inc.,$11.86,0.01,0.084%,0.00,United States,2011,11056,Finance,Trusts Except Educational Religious and Charitable
DPRO,Draganfly Inc. Common Shares,$2.5565,-0.0035,-0.137%,10808358.00,Canada,,23801,Industrials,Aerospace
DPZ,Domino's Pizza Inc Common Stock,$481.66,2.55,0.532%,16519354302.00,United States,2004,63803,Consumer Discretionary,Food Distributors
DQ,DAQO New Energy Corp. American Depositary Shares each representing five ordinary shares,$22.29,0.40,1.827%,1471306083.00,China,2010,609122,Technology,Semiconductors
DRCT,Direct Digital Holdings Inc. Class A Common Stock,$0.96,-0.05,-4.95%,14081185.00,United States,2022,93893,Consumer Discretionary,Advertising
DRD,DRDGOLD Limited American Depositary Shares,$11.045,-0.415,-3.621%,954938230.00,South Africa,,140539,Basic Materials,Precious Metals
DRDB,Roman DBDR Acquisition Corp. II Ordinary shares,$9.95,0.00,0.00%,0.00,United States,2025,1,,
DRDBU,Roman DBDR Acquisition Corp. II Unit,$10.14,0.02,0.198%,0.00,United States,2024,2092,,
DRDBW,Roman DBDR Acquisition Corp. II Warrants,$0.30,0.00,0.00%,0.00,United States,2025,17,,
DRH,Diamondrock Hospitality Company Common Stock,$8.28,0.09,1.099%,1718863499.00,United States,2005,255446,Real Estate,Real Estate Investment Trusts
DRH^A,Diamondrock Hospitality Company 8.250% Series A Cumulative Redeemable Preferred Stock,$25.4459,-0.0212,-0.083%,,United States,,507,,
DRI,Darden Restaurants Inc. Common Stock,$194.72,0.68,0.35%,22810822170.00,United States,,130606,Consumer Discretionary,Restaurants
DRIO,DarioHealth Corp. Common Stock,$0.6899,-0.0002,-0.029%,23523075.00,Israel,,52005,Health Care,Medical/Dental Instruments
DRMA,Dermata Therapeutics Inc. Common Stock,$1.16,-0.03,-2.521%,2367291.00,United States,2021,18620,Health Care,Biotechnology: Pharmaceutical Preparations
DRMAW,Dermata Therapeutics Inc. Warrant,$0.028,-0.002,-6.667%,57142.00,United States,2021,2000,Health Care,Biotechnology: Pharmaceutical Preparations
DRRX,DURECT Corporation Common Stock,$0.80,0.0001,0.013%,24833585.00,United States,2000,31955,Health Care,Biotechnology: Pharmaceutical Preparations
DRS,Leonardo DRS Inc. Common Stock,$30.01,0.11,0.368%,7934555741.00,Israel,,83880,Industrials,Industrial Machinery/Components
DRTS,Alpha Tau Medical Ltd. Ordinary Shares,$2.67,-0.03,-1.111%,186020534.00,Israel,,10145,Health Care,Medical/Dental Instruments
DRTSW,Alpha Tau Medical Ltd. Warrant,$0.2998,0.0598,24.917%,20887249.00,Israel,,205,Health Care,Medical/Dental Instruments
DRUG,Bright Minds Biosciences Inc. Common Stock,$34.0489,0.3789,1.125%,237967388.00,Canada,,4451,Health Care,Biotechnology: Pharmaceutical Preparations
DRVN,Driven Brands Holdings Inc. Common Stock,$16.305,-0.045,-0.275%,2675880384.00,United States,2021,183247,Consumer Discretionary,Automotive Aftermarket
DSGN,Design Therapeutics Inc. Common Stock,$4.82,0.08,1.688%,272913398.00,United States,2021,14363,Health Care,Biotechnology: Pharmaceutical Preparations
DSGR,Distribution Solutions Group Inc. Common Stock,$29.89,-0.58,-1.904%,1399984233.00,United States,,3336,Consumer Discretionary,Industrial Specialties
DSGX,Descartes Systems Group Inc. (The) Common Stock,$111.42,-0.58,-0.518%,9530804071.00,Canada,,23406,Technology,Computer Software: Prepackaged Software
DSL,DoubleLine Income Solutions Fund Common Shares of Beneficial Interests,$12.8199,0.0399,0.312%,1307589135.00,United States,2013,100325,Finance,Trusts Except Educational Religious and Charitable
DSM,BNY Mellon Strategic Municipal Bond Fund Inc. Common Stock,$6.055,-0.005,-0.083%,0.00,United States,1989,18932,Finance,Investment Managers
DSP,Viant Technology Inc. Class A Common Stock,$20.96,0.53,2.594%,1317374210.00,United States,2021,101573,Technology,Computer Software: Programming Data Processing
DSS,DSS Inc. Common Stock,$0.88,0.00,0.00%,6218759.00,United States,,317,Consumer Discretionary,Containers/Packaging
DSU,Blackrock Debt Strategies Fund Inc. Common Stock,$10.635,-0.065,-0.607%,0.00,United States,1998,169825,Finance,Finance Companies
DSWL,Deswell Industries Inc. Common Shares,$2.39,0.00,0.00%,38085221.00,Macau,1995,126,Industrials,Plastic Products
DSX,Diana Shipping inc. common stock,$1.905,0.025,1.33%,228529357.00,Greece,2005,105067,Consumer Discretionary,Marine Transportation
DSX^B,Diana Shipping Inc. Perpetual Preferred Shares Series B (Marshall Islands),$26.55,0.1697,0.643%,,Greece,,338,,
DSY,Big Tree Cloud Holdings Limited Ordinary Shares,$2.00,-0.0613,-2.974%,114161092.00,China,,17869,Consumer Discretionary,Containers/Packaging
DSYWW,Big Tree Cloud Holdings Limited Warrants,$0.0272,0.00,0.00%,1552591.00,China,,400,Consumer Discretionary,Containers/Packaging
DT,Dynatrace Inc. Common Stock,$58.89,0.10,0.17%,17628723443.00,United States,2019,811817,Technology,Computer Software: Prepackaged Software
DTB,DTE Energy Company 2020 Series G 4.375% Junior Subordinated Debentures due 2080,$18.72,-0.11,-0.584%,3879577541.00,United States,2020,4104,Utilities,Electric Utilities: Central
DTC,Solo Brands Inc. Class A Common Stock,$0.7831,-0.0129,-1.621%,71788038.00,United States,2021,213828,Consumer Discretionary,Recreational Games/Products/Toys
DTCK,Davis Commodities Limited Ordinary Shares,$0.95,-0.0125,-1.299%,23275594.00,Singapore,2023,8144,Industrials,Farming/Seeds/Milling
DTE,DTE Energy Company Common Stock,$132.165,-0.485,-0.366%,27390190474.00,United States,,76082,Utilities,Electric Utilities: Central
DTF,DTF Tax-Free Income 2028 Term Fund Inc. Common Stock,$11.34,-0.005,-0.044%,79715290.00,United States,1991,270,Finance,Investment Managers
DTG,DTE Energy Company 2021 Series E 4.375% Junior Subordinated Debentures,$18.54,-0.01,-0.054%,3842273911.00,United States,2021,3991,Utilities,Electric Utilities: Central
DTI,Drilling Tools International Corporation Common Stock,$3.1001,-0.0699,-2.205%,107588028.00,United States,2021,5844,Industrials,Metal Fabrications
DTIL,Precision BioSciences Inc. Common Stock,$5.5346,0.0246,0.446%,42456243.00,United States,2019,1307,Health Care,Biotechnology: Biological Products (No Diagnostic Substances)
DTM,DT Midstream Inc. Common Stock ,$93.77,-1.14,-1.201%,9110331623.00,United States,2021,306042,Utilities,Natural Gas Distribution
DTSQ,DT Cloud Star Acquisition Corporation Ordinary Shares,$10.18,0.00,0.00%,0.00,United States,2024,1,,
DTSS,Datasea Inc. Common Stock,$2.25,-0.02,-0.881%,16851155.00,China,,15191,Technology,Computer Software: Prepackaged Software
DTST,Data Storage Corporation Common Stock,$3.9115,-0.0285,-0.723%,27436720.00,United States,,8511,Technology,EDP Services
DTSTW,Data Storage Corporation Warrant,$0.381,-0.0023,-0.60%,2672476.00,United States,,4273,Technology,EDP Services
DTW,DTE Energy Company 2017 Series E 5.25% Junior Subordinated Debentures due 2077,$22.7475,-0.1225,-0.536%,4714246267.00,United States,2017,5763,Utilities,Electric Utilities: Central
DUK,Duke Energy Corporation (Holding Company) Common Stock,$115.93,-0.38,-0.327%,89553885212.00,United States,,467927,Utilities,Power Generation
DUK^A,Duke Energy Corporation Depositary Shares each representing a 1/1000th interest in a share of 5.75% Series A Cumulative Redeemable Perpetual Preferred Stock,$25.085,0.025,0.10%,,United States,,4584,,
DUKB,Duke Energy Corporation 5.625% Junior Subordinated Debentures due 2078,$24.8211,0.0011,0.004%,19173863023.00,United States,2018,2060,Utilities,Power Generation
DUO,Fangdd Network Group Ltd. Class A Ordinary Shares,$0.5486,-0.0146,-2.592%,3494582.00,China,2019,1499810,Finance,Real Estate
DUOL,Duolingo Inc. Class A Common Stock,$390.59,4.03,1.043%,17179928509.00,United States,2021,267407,Technology,Computer Software: Prepackaged Software
DUOT,Duos Technologies Group Inc. Common Stock,$6.005,-0.125,-2.039%,50505803.00,United States,,9104,Technology,Computer Software: Prepackaged Software
DV,DoubleVerify Holdings Inc. Common Stock,$21.86,0.27,1.251%,3697947097.00,United States,2021,236563,Technology,Computer Software: Programming Data Processing
DVA,DaVita Inc. Common Stock,$147.34,1.39,0.952%,11787200000.00,United States,,106846,Health Care,Misc Health and Biotechnology Services
DVAX,Dynavax Technologies Corporation Common Stock,$13.795,0.105,0.767%,1711557086.00,United States,2004,192949,Health Care,Biotechnology: Pharmaceutical Preparations
DVLT,Datavault AI Inc. Common Stock,$0.9861,-0.0539,-5.183%,7659855.00,United States,2018,218056,Technology,Semiconductors
DVN,Devon Energy Corporation Common Stock,$36.23,0.77,2.171%,23513270000.00,United States,1985,1579891,Energy,Oil & Gas Production
DWSN,Dawson Geophysical Company Common Stock,$1.36,-0.0138,-1.005%,42137474.00,United States,,1582,Energy,Oil & Gas Production
DWTX,Dogwood Therapeutics Inc. Common Stock,$4.7913,-0.3287,-6.42%,6382864.00,United States,2020,15610,Health Care,Biotechnology: Pharmaceutical Preparations
DX,Dynex Capital Inc. Common Stock,$13.99,0.03,0.215%,1109456301.00,United States,,304911,Real Estate,Real Estate Investment Trusts
DX^C,Dynex Capital Inc. 6.900% Series C Fixed-to-Floating Rate Cumulative Redeemable Preferred Stock,$25.38,-0.07,-0.275%,,United States,,7810,,
DXC,DXC Technology Company Common Stock ,$18.535,-0.035,-0.188%,3355735078.00,United States,,79128,Technology,EDP Services
DXCM,DexCom Inc. Common Stock,$89.38,-0.53,-0.589%,34927202969.00,United States,2005,379371,Health Care,Medical/Dental Instruments
DXF,Eason Technology Limited American Depositary Shares (each representing sixty-thousand (60000) Ordinary Shares),$11.00,-0.55,-4.762%,2744104.00,,,2178,Finance,Finance: Consumer Services
DXLG,Destination XL Group Inc. Common Stock,$2.22,-0.06,-2.632%,120562066.00,United States,,10275,Consumer Discretionary,Clothing/Shoe/Accessory Stores
DXPE,DXP Enterprises Inc. Common Stock,$91.14,0.09,0.099%,1430431637.00,United States,,23885,Industrials,Industrial Machinery/Components
DXR,Daxor Corporation Common Stock,$7.56,-0.18,-2.326%,36590400.00,United States,,660,Health Care,Medical/Dental Instruments
DXST,Decent Holding Inc Ordinary Shares,$1.41,-0.01,-0.704%,23265000.00,China,2025,9059,Industrials,Miscellaneous
DXYZ,Destiny Tech100 Inc. Common Stock,$41.245,0.345,0.844%,0.00,,2024,264276,,
DY,Dycom Industries Inc. Common Stock,$162.97,1.01,0.624%,4754790719.00,United States,,140985,Industrials,Water Sewer Pipeline Comm & Power Line Construction
DYAI,Dyadic International Inc. Common Stock,$1.42,0.07,5.185%,42016907.00,United States,,3065,Health Care,Biotechnology: Biological Products (No Diagnostic Substances)
DYCQ,DT Cloud Acquisition Corporation Ordinary Shares,$10.55,0.02,0.19%,0.00,United Kingdom,2024,909,,
DYCQR,DT Cloud Acquisition Corporation Right,$0.2699,0.0399,17.348%,0.00,United Kingdom,2024,5100,,
DYN,Dyne Therapeutics Inc. Common Stock,$13.665,-0.125,-0.906%,1390631816.00,United States,2020,265248,Health Care,Biotechnology: Pharmaceutical Preparations
DYNX,Dynamix Corporation Class A Ordinary Shares,$9.87,0.00,0.00%,0.00,United States,2024,9244,,
DYNXU,Dynamix Corporation Unit,$9.99,-0.02,-0.20%,0.00,United States,2024,37500,,
DYNXW,Dynamix Corporation Warrant,$0.28,0.02,7.692%,0.00,United States,2024,177453,,
E,ENI S.p.A. Common Stock,$29.36,-0.55,-1.839%,49558768284.00,Italy,,113184,Energy,Oil & Gas Production
EA,Electronic Arts Inc. Common Stock,$131.495,0.305,0.232%,34269910523.00,United States,,610833,Technology,Computer Software: Prepackaged Software
EAD,Allspring Income Opportunities Fund Common Shares,$7.015,-0.005,-0.071%,0.00,United States,2003,51907,Finance,Finance/Investors Services
EAF,GrafTech International Ltd. Common Stock,$1.19,0.03,2.586%,306143815.00,United States,2018,165423,Energy,Industrial Machinery/Components
EAI,Entergy Arkansas LLC First Mortgage Bonds 4.875% Series Due September 1 2066,$21.77,0.04,0.184%,9370081867.00,United States,2016,718,Utilities,Electric Utilities: Central
EARN,Ellington Credit Company Common Shares of Beneficial Interest,$6.53,0.02,0.307%,188066253.00,United States,2013,150341,Real Estate,Real Estate Investment Trusts
EAT,Brinker International Inc. Common Stock,$159.925,-0.165,-0.103%,7101766606.00,United States,,224996,Consumer Discretionary,Restaurants
EB,Eventbrite Inc. Class A Common Stock,$3.11,-0.07,-2.201%,301299534.00,United States,2018,218634,Technology,Computer Software: Programming Data Processing
EBAY,eBay Inc. Common Stock,$62.86,-6.28,-9.083%,30109940000.00,United States,1998,5515427,Consumer Discretionary,Business Services
EBC,Eastern Bankshares Inc. Common Stock,$17.695,0.085,0.483%,3798469199.00,United States,2020,83715,Finance,Savings Institutions
EBF,Ennis Inc. Common Stock,$21.125,-0.105,-0.495%,549516238.00,United States,,11274,Consumer Discretionary,Office Equipment/Supplies/Services
EBMT,Eagle Bancorp Montana Inc. Common Stock,$17.92,0.01,0.056%,143660769.00,United States,2010,1493,Finance,Major Banks
EBON,Ebang International Holdings Inc. Class A Ordinary Shares,$4.5799,0.0619,1.37%,29970582.00,China,2020,3659,Technology,Semiconductors
EBR,Centrais Electricas Brasileiras S A American Depositary Shares (Each representing one Common Share),$6.41,-0.05,-0.774%,14395669548.00,Brazil,2016,195284,Utilities,Electric Utilities: Central
EBS,Emergent BioSolutions Inc. Common Stock,$7.30,0.03,0.413%,395544558.00,United States,2006,125517,Health Care,Biotechnology: Pharmaceutical Preparations
EBTC,Enterprise Bancorp Inc Common Stock,$42.88,0.03,0.07%,532963667.00,United States,,5660,Finance,Major Banks
EC,Ecopetrol S.A. American Depositary Shares,$9.985,-0.135,-1.334%,20527509829.00,Colombia,,1056421,Energy,Oil & Gas Production
ECAT,BlackRock ESG Capital Allocation Term Trust Common Shares of Beneficial Interest,$16.595,0.065,0.393%,1794500325.00,United States,2021,48426,Finance,Trusts Except Educational Religious and Charitable
ECBK,ECB Bancorp Inc. Common Stock,$14.71,0.00,0.00%,134118734.00,United States,2022,82,Finance,Banks
ECC           ,Eagle Point Credit Company Inc. Common Stock,$8.71,-0.01,-0.115%,528370584.00,United States,2014,98046,Finance,Trusts Except Educational Religious and Charitable
ECC^D,Eagle Point Credit Company Inc. 6.75% Series D Preferred Stock,$20.21,0.00,0.00%,,United States,,424,,
ECCC,Eagle Point Credit Company Inc. 6.50% Series C Term Preferred Stock due 2031,$23.16,0.09,0.39%,1404944056.00,United States,,10419,Finance,Trusts Except Educational Religious and Charitable
ECCF,Eagle Point Credit Company Inc. 8.00% Series F Term Preferred Stock due 2029,$24.97,0.01,0.04%,27184160515.00,United States,,333,,
ECCU,Eagle Point Credit Company Inc. 7.75% Notes due 2030,$24.9899,0.0199,0.08%,0.00,United States,2024,4067,,
ECCV,Eagle Point Credit Company Inc. 5.375% Notes due 2029,$23.08,0.00,0.00%,1400091054.00,United States,2022,1,Finance,Trusts Except Educational Religious and Charitable
ECCW,Eagle Point Credit Company Inc. 6.75% Notes due 2031,$24.045,-0.1261,-0.522%,1458630390.00,United States,2021,310,Finance,Trusts Except Educational Religious and Charitable
ECCX,Eagle Point Credit Company Inc. 6.6875% Notes due 2028,$24.9537,0.00,0.00%,1513754425.00,United States,2022,12,Finance,Trusts Except Educational Religious and Charitable
ECDA,ECD Automotive Design Inc. Common Stock,$0.844,0.014,1.687%,29244315.00,United States,2022,820,Consumer Discretionary,Auto Manufacturing
ECF,Ellsworth Growth and Income Fund Ltd.,$9.752,0.012,0.123%,0.00,United States,1986,4536,Finance,Finance/Investors Services
ECF^A,Ellsworth Growth and Income Fund Ltd. 5.25% Series A Cumulative Preferred Shares (Liquidation Preference $25.00 per share),$22.1424,0.00,0.00%,,United States,,10,,
