Symbol,Name,Last Sale,Net Change,% Change,Market Cap,Country,IPO Year,Volume,Sector,Industry
PSEC,Prospect Capital Corporation Common Stock,$4.3258,-0.0042,-0.097%,1915226079.00,United States,2004,521693,Finance,Finance: Consumer Services
PSEC^A,Prospect Capital Corporation 5.35% Series A Fixed Rate Cumulative Perpetual Preferred Stock,$17.155,-0.115,-0.666%,,United States,,552,,
PSF,Cohen & Steers Select Preferred and Income Fund Inc. Common Stock,$20.22,0.00,0.00%,993583058.00,,2010,12464,Finance,Investment Managers
PSFE,Paysafe Limited Common Shares,$19.62,0.14,0.719%,1210935472.00,,2021,27435,Consumer Discretionary,Business Services
PSHG,Performance Shipping Inc. Common Shares,$1.635,-0.005,-0.305%,20077270.00,Greece,,3667,Consumer Discretionary,Marine Transportation
PSIG,PS International Group Ltd. Ordinary Shares,$0.4905,0.0005,0.102%,11910781.00,Hong Kong,,67925,Consumer Discretionary,Oil Refining/Marketing
PSIX,Power Solutions International Inc. Common Stock,$34.3245,0.1145,0.335%,789450319.00,United States,,69502,Industrials,Industrial Machinery/Components
PSMT,PriceSmart Inc. Common Stock,$90.72,-0.17,-0.187%,2781687938.00,United States,,17055,Consumer Discretionary,Department/Specialty Retail Stores
PSN,Parsons Corporation Common Stock,$58.65,-0.43,-0.728%,6262478440.00,United States,2019,81826,Technology,EDP Services
PSNL,Personalis Inc. Common Stock,$4.53,0.05,1.116%,320035821.00,United States,2019,145429,Health Care,Medical Specialities
PSNY,Polestar Automotive Holding UK PLC Class A ADS,$1.11,0.00,0.00%,2370083420.00,Sweden,,1578057,Consumer Discretionary,Auto Manufacturing
PSNYW,Polestar Automotive Holding UK PLC Class C-1 ADS (ADW),$0.1985,-0.0003,-0.151%,423839242.00,Sweden,,3715,Consumer Discretionary,Auto Manufacturing
PSO,Pearson Plc Common Stock,$16.88,0.16,0.957%,11246550347.00,United Kingdom,,167233,Consumer Discretionary,Books
PSQH,PSQ Holdings Inc. Class A Common Stock,$2.81,0.04,1.444%,97681844.00,,2021,291228,Consumer Discretionary,Advertising
PSTG,Pure Storage Inc. Class A Common Stock,$55.8868,-6.5532,-10.495%,18232340407.00,United States,2015,2490972,Technology,Electronic Components
PSTL,Postal Realty Trust Inc. Class A Common Stock,$13.73,1.31,10.548%,322014688.00,United States,2019,218097,Real Estate,Real Estate Investment Trusts
PSTV,PLUS THERAPEUTICS Inc. Common Stock ,$0.70,-0.06,-7.895%,4127433.00,United States,,93762,Health Care,Medical/Dental Instruments
PSX,Phillips 66 Common Stock,$127.92,2.48,1.977%,52152772548.00,United States,,615631,Energy,Integrated oil Companies
PT,Pintec Technology Holdings Limited American Depositary Shares,$1.0001,0.0281,2.891%,15949556.00,China,2018,52871,Technology,Computer Software: Programming Data Processing
PTA,Cohen & Steers Tax-Advantaged Preferred Securities and Income Fund Common Shares of Beneficial Interest,$19.925,-0.045,-0.225%,1101323631.00,United States,2020,13778,Finance,Trusts Except Educational Religious and Charitable
PTC,PTC Inc. Common Stock,$163.94,0.91,0.558%,19725841475.00,United States,,100458,Technology,Computer Software: Prepackaged Software
PTCT,PTC Therapeutics Inc. Common Stock,$51.42,0.46,0.903%,3965774853.00,United States,2013,123347,Health Care,Biotechnology: Pharmaceutical Preparations
PTEN,Patterson-UTI Energy Inc. Common Stock,$8.175,0.275,3.481%,3158740678.00,United States,1993,3328782,Energy,Oil & Gas Production
PTGX,Protagonist Therapeutics Inc. Common Stock,$36.69,0.54,1.494%,2252189563.00,United States,2016,80425,Health Care,Biotechnology: Pharmaceutical Preparations
PTHL,Pheton Holdings Ltd Class A Ordinary Shares,$2.06,0.05,2.488%,29870000.00,China,2024,10045,Health Care,Biotechnology: Electromedical & Electrotherapeutic Apparatus
PTIX,Protagenic Therapeutics Inc. Common Stock,$0.2536,-0.003,-1.169%,1723167.00,United States,,39240,Health Care,Biotechnology: Pharmaceutical Preparations
PTLE,PTL LTD Ordinary Shares,$1.20,-0.04,-3.226%,15000000.00,Singapore,2024,12390,Energy,Oil Refining/Marketing
PTLO,Portillo's Inc. Class A Common Stock,$13.965,0.015,0.108%,1041824290.00,United States,2021,193429,Consumer Discretionary,Restaurants
PTMN,Portman Ridge Finance Corporation Common Stock,$17.25,0.06,0.349%,158923888.00,United States,2006,1276,Finance,Finance: Consumer Services
PTN,Palatin Technologies Inc. Common Stock,$0.9101,-0.0696,-7.104%,23667920.00,United States,1999,116702,Health Care,Biotechnology: Pharmaceutical Preparations
PTON,Peloton Interactive Inc. Class A Common Stock,$7.825,-0.055,-0.698%,3051472181.00,United States,2019,2071428,Consumer Discretionary,Recreational Games/Products/Toys
PTPI,Petros Pharmaceuticals Inc. Common Stock,$0.1057,0.001,0.955%,1058572.00,United States,,6590835,Health Care,Biotechnology: Pharmaceutical Preparations
PTVE,Pactiv Evergreen Inc. Common stock,$17.835,0.005,0.028%,3221545574.00,United States,2020,99885,Consumer Discretionary,Containers/Packaging
PTY,Pimco Corporate & Income Opportunity Fund,$14.73,0.02,0.136%,0.00,United States,2002,152666,Finance,Investment Managers
PUBM,PubMatic Inc. Class A Common Stock,$14.2728,-0.1172,-0.814%,681765184.00,United States,2020,93079,Technology,Computer Software: Programming Data Processing
PUK,Prudential Public Limited Company Common Stock,$18.34,-0.11,-0.596%,24252389852.00,United Kingdom,,213253,Finance,Life Insurance
PULM,Pulmatrix Inc. Common Stock,$7.835,-0.305,-3.747%,28615653.00,United States,2014,8865,Health Care,Biotechnology: Pharmaceutical Preparations
PUMP,ProPetro Holding Corp. Common Stock,$8.575,0.105,1.24%,884671225.00,United States,2017,127470,Energy,Oilfield Services/Equipment
PVBC,Provident Bancorp Inc. (MD) Common Stock,$11.96,-0.06,-0.499%,212051314.00,United States,2015,307,Finance,Banks
PVH,PVH Corp. Common Stock,$76.45,-1.85,-2.363%,4253157987.00,United States,,137088,Consumer Discretionary,Apparel
PVL,Permianville Royalty Trust Trust Units ,$1.43,0.00,0.00%,47190000.00,United States,2011,2252,Energy,Oil & Gas Production
PVLA,Palvella Therapeutics Inc. Common Stock,$19.215,0.415,2.207%,25368412.00,United States,,2442,Health Care,Biotechnology: Pharmaceutical Preparations
PW,Power REIT (MD) Common Stock,$1.1468,-0.1032,-8.256%,3887263.00,United States,1998,42410,Real Estate,Real Estate Investment Trusts
PW^A,Power REIT 7.75% Series A Cumulative Perpetual Preferred Stock,$7.06,-0.54,-7.105%,,United States,,337,,
PWM,Prestige Wealth Inc. Class A Ordinary Shares,$0.6202,-0.0488,-7.294%,19624343.00,Hong Kong,2023,11474,Finance,Finance: Consumer Services
PWOD,Penns Woods Bancorp Inc. Common Stock,$30.01,-0.14,-0.464%,226411375.00,United States,,632,Finance,Major Banks
PWP,Perella Weinberg Partners Class A Common Stock,$23.17,0.37,1.623%,2042747762.00,United States,2020,109419,Finance,Finance: Consumer Services
PWR,Quanta Services Inc. Common Stock,$265.00,-3.81,-1.417%,39272555065.00,United States,,380854,Industrials,Engineering & Construction
PX,P10 Inc. Class A Common Stock,$12.77,-0.04,-0.312%,1425422581.00,United States,2021,34720,Finance,Investment Managers
PXLW,Pixelworks Inc.  Common Stock,$0.7518,-0.0264,-3.392%,44309895.00,United States,2000,66752,Technology,Semiconductors
PXS,Pyxis Tankers Inc. Common Stock,$3.58,0.01,0.28%,37742318.00,Greece,,1781,Consumer Discretionary,Marine Transportation
PXSAW,Pyxis Tankers Inc. Warrant,$0.1193,-0.0107,-8.231%,1257726.00,Greece,,20979,Consumer Discretionary,Marine Transportation
PYCR,Paycor HCM Inc. Common Stock,$22.135,-0.015,-0.068%,4023522069.00,United States,2021,841351,Technology,Computer Software: Prepackaged Software
PYN,PIMCO New York Municipal Income Fund III Common Shares of Beneficial Interest,$5.93,-0.03,-0.503%,0.00,United States,2002,701,Finance,Investment Managers
PYPD,PolyPid Ltd. Ordinary Shares,$2.92,-0.18,-5.806%,19866156.00,Israel,2020,2421,Health Care,Biotechnology: Pharmaceutical Preparations
PYPL,PayPal Holdings Inc. Common Stock,$72.205,0.155,0.215%,71428251247.00,United States,,2845600,Consumer Discretionary,Business Services
PYT,PPlus Tr GSC-2 Tr Ctf Fltg Rate,$23.10,-0.0007,-0.003%,0.00,United States,,2418,Finance,Finance: Consumer Services
PYXS,Pyxis Oncology Inc. Common Stock,$1.1208,-0.0092,-0.814%,66649189.00,United States,2021,218466,Health Care,Biotechnology: Pharmaceutical Preparations
PZC,PIMCO California Municipal Income Fund III Common Shares of Beneficial Interest,$6.915,0.015,0.217%,0.00,United States,2002,5618,Finance,Investment Managers
PZG,Paramount Gold Nevada Corp. Common Stock,$0.365,-0.004,-1.084%,24674981.00,United States,2015,10010,Basic Materials,Metal Mining
PZZA,Papa John's International Inc. Common Stock,$47.06,0.82,1.773%,1536114778.00,United States,1993,334815,Consumer Discretionary,Restaurants
QBTS,D-Wave Quantum Inc. Common Shares,$6.1022,-0.0378,-0.616%,1366983290.00,,2022,17921443,Technology,EDP Services
QCOM,QUALCOMM Incorporated Common Stock,$159.87,-2.23,-1.376%,176816220000.00,United States,1991,1180305,Technology,Radio And Television Broadcasting And Communications Equipment
QCRH,QCR Holdings Inc. Common Stock,$74.91,0.22,0.295%,1263651621.00,United States,,6142,Finance,Major Banks
QD,Qudian Inc. American Depositary Shares each representing one Class A Ordinary Share,$2.93,0.03,1.034%,554953283.00,China,2017,38304,Finance,Finance: Consumer Services
QDEL,QuidelOrtho Corporation Common Stock,$40.15,-0.73,-1.786%,2700357188.00,United States,,38754,Health Care,Biotechnology: In Vitro & In Vivo Diagnostic Substances
QETA,Quetta Acquisition Corporation Common Stock,$10.67,-0.03,-0.28%,0.00,United States,2023,1000,Finance,Blank Checks
QETAR,Quetta Acquisition Corporation Right,$1.80,0.37,25.874%,0.00,United States,2023,11763,Finance,Blank Checks
QFIN,Qifu Technology Inc. American Depositary Shares,$41.86,-0.18,-0.428%,6498952324.00,China,2018,268661,Finance,Finance: Consumer Services
QGEN,Qiagen N.V. Common Shares,$38.765,-0.385,-0.983%,8342535174.00,Netherlands,,183983,Health Care,Biotechnology: Biological Products (No Diagnostic Substances)
QH,Quhuo Limited American Depository Shares,$1.52,0.04,2.703%,9374784.00,China,2020,31586,Consumer Discretionary,Business Services
QIPT,Quipt Home Medical Corp. Common Shares,$2.72,-0.02,-0.73%,117208263.00,United States,,20621,Health Care,Misc Health and Biotechnology Services
QLGN,Qualigen Therapeutics Inc. Common Stock,$3.1654,-0.0246,-0.771%,2331099.00,United States,2015,1663,Health Care,Biotechnology: Pharmaceutical Preparations
QLYS,Qualys Inc. Common Stock,$132.99,-0.27,-0.203%,4851165599.00,United States,2012,43529,Technology,Computer Software: Prepackaged Software
QMCO,Quantum Corporation Common Stock,$12.54,-1.07,-7.862%,73160855.00,United States,,207145,Technology,Electronic Components
QMMM,QMMM Holdings Limited Ordinary Shares,$0.74,0.029,4.079%,12732693.00,Hong Kong,2024,52740,Consumer Discretionary,Advertising
QNCX,Quince Therapeutics Inc. Common Stock,$1.345,0.015,1.128%,59182210.00,United States,2019,10922,Health Care,Biotechnology: Biological Products (No Diagnostic Substances)
QNRX,Quoin Pharmaceuticals Ltd. American Depositary Shares,$0.4134,0.1056,34.308%,2087554.00,Israel,2016,108074908,Health Care,Medical/Dental Instruments
QNST,QuinStreet Inc. Common Stock,$19.35,-0.24,-1.225%,1092667410.00,United States,2010,20837,Consumer Discretionary,Business Services
QNTM,Quantum Biopharma Ltd. Class B Subordinate Voting Shares,$5.2807,-0.4893,-8.48%,6867445.00,Canada,,123635,Health Care,Biotechnology: Pharmaceutical Preparations
QQQX,Nuveen NASDAQ 100 Dynamic Overwrite Fund Shares of Beneficial Interest,$26.155,-0.065,-0.248%,0.00,United States,,40938,Finance,Finance Companies
QRHC,Quest Resource Holding Corporation Common Stock,$4.525,-0.045,-0.985%,93159229.00,United States,,2387,Utilities,Environmental Services
QRVO,Qorvo Inc. Common Stock,$74.05,-0.49,-0.657%,6916035410.00,United States,,200783,Technology,Semiconductors
QS,QuantumScape Corporation Class A Common Stock,$4.9899,0.0799,1.627%,2557180161.00,United States,2020,2633478,Miscellaneous,Industrial Machinery/Components
QSG,QuantaSing Group Limited American Depositary Shares,$2.41,-0.05,-2.033%,123182337.00,China,2023,36171,Real Estate,Other Consumer Services
QSI,Quantum-Si Incorporated Class A Common Stock,$1.465,-0.025,-1.678%,209074328.00,United States,2020,1585292,Industrials,Industrial Machinery/Components
QSIAW,Quantum-Si Incorporated Warrant,$0.486,-0.034,-6.538%,69358446.00,United States,2020,5480,Industrials,Industrial Machinery/Components
QSR,Restaurant Brands International Inc. Common Shares,$64.295,0.595,0.934%,29062833058.00,Canada,2014,195522,Consumer Discretionary,Restaurants
QTRX,Quanterix Corporation Common Stock,$7.865,-0.145,-1.81%,302993824.00,United States,2017,94287,Industrials,Biotechnology: Laboratory Analytical Instruments
QTTB,Q32 Bio Inc. Common Stock,$2.33,-0.01,-0.427%,28381033.00,United States,2018,28044,Health Care,Biotechnology: Pharmaceutical Preparations
QTWO,Q2 Holdings Inc. Common Stock,$86.51,0.30,0.348%,5253578069.00,United States,2014,39328,Technology,Computer Software: Prepackaged Software
QUAD,Quad Graphics Inc Class A Common Stock,$6.14,-0.04,-0.647%,321414847.00,United States,,37027,Consumer Discretionary,Publishing
QUBT,Quantum Computing Inc. Common Stock,$6.60,-0.25,-3.65%,653970742.00,United States,,2726379,Technology,Computer Software: Prepackaged Software
QUIK,QuickLogic Corporation Common Stock,$6.7708,-0.5392,-7.376%,99578643.00,United States,1999,98570,Technology,Semiconductors
QURE,uniQure N.V. Ordinary Shares,$11.49,-0.18,-1.542%,560058679.00,Netherlands,2014,235570,Health Care,Biotechnology: Pharmaceutical Preparations
QVCC,QVC Inc. 6.250% Senior Secured Notes due 2068,$12.42,-0.02,-0.161%,12.00,United States,2019,10998,Consumer Discretionary,Catalog/Specialty Distribution
QVCD,QVC Inc. 6.375% Senior Secured Notes due 2067,$12.5479,0.0579,0.464%,13.00,United States,2018,1963,Consumer Discretionary,Catalog/Specialty Distribution
QVCGA,QVC Group Inc. Series A Common Stock,$0.3855,-0.0184,-4.556%,0.00,United States,,1187281,,
QVCGB,QVC Group Inc. Series B Common Stock,$7.7202,-1.9998,-20.574%,0.00,United States,,128384,,
QVCGP,QVC Group Inc. 8.0% Fixed Rate Cumulative Redeemable Preferred Stock,$39.30,-0.149,-0.378%,0.00,United States,,9200,,
QXO,QXO Inc. Common Stock,$12.29,0.07,0.573%,5031897097.00,United States,,154384,Technology,EDP Services
R,Ryder System Inc. Common Stock,$161.615,0.435,0.27%,6801555639.00,United States,,27252,Consumer Discretionary,Rental/Leasing Companies
RA,Brookfield Real Assets Income Fund Inc. Common Stock,$13.3701,0.0301,0.226%,0.00,United States,2016,27205,Finance,Investment Managers
RACE,Ferrari N.V. Common Shares,$461.90,-18.10,-3.771%,111954030528.00,Italy,2015,483202,Consumer Discretionary,Auto Manufacturing
RADX,Radiopharm Theranostics Limited American Depositary Shares,$5.44,0.51,10.345%,0.00,Australia,,52175,,
RAIL,FreightCar America Inc. Common Stock,$8.00,0.03,0.376%,151151776.00,United States,2005,41352,Industrials,Railroads
RAIN,Rain Enhancement Technologies Holdco Inc. Class A Common Stock,$2.31,0.00,0.00%,15306894.00,United States,,4372,Technology,Industrial Machinery/Components
RAINW,Rain Enhancement Technologies Holdco Inc. Warrants,$0.111,-0.009,-7.50%,735526.00,United States,,2469,Technology,Industrial Machinery/Components
RAMP,LiveRamp Holdings Inc. Common Stock,$30.01,0.10,0.334%,1973478307.00,United States,2018,69071,Technology,EDP Services
RAND,Rand Capital Corporation Common Stock,$25.70,-0.25,-0.963%,66332240.00,United States,,1546,Finance,Finance: Consumer Services
RANG,Range Capital Acquisition Corp. Ordinary Shares,$10.01,0.00,0.00%,0.00,United States,2025,4,,
RANGR,Range Capital Acquisition Corp. Rights,$0.2504,0.0104,4.333%,0.00,United States,2025,13819,,
RANGU,Range Capital Acquisition Corp. Units,$10.2099,-0.0051,-0.05%,0.00,United States,2024,2525,,
RANI,Rani Therapeutics Holdings Inc. Class A Common Stock,$1.56,0.02,1.299%,89370344.00,United States,2021,88018,Health Care,Biotechnology: Pharmaceutical Preparations
RAPP,Rapport Therapeutics Inc. Common Stock,$11.49,0.45,4.076%,420263491.00,United States,2024,26082,Health Care,Biotechnology: Pharmaceutical Preparations
RAPT,RAPT Therapeutics Inc. Common Stock,$1.145,-0.025,-2.137%,40027200.00,United States,2019,46465,Health Care,Biotechnology: Pharmaceutical Preparations
RARE,Ultragenyx Pharmaceutical Inc. Common Stock,$43.03,1.41,3.388%,3980323452.00,United States,2014,124186,Health Care,Biotechnology: Pharmaceutical Preparations
RAVE,Rave Restaurant Group Inc. Common Stock,$2.76,-0.06,-2.128%,40603922.00,United States,,1098,Consumer Discretionary,Food Distributors
RAY,Raytech Holding Limited Ordinary Shares,$0.975,-0.115,-10.55%,17172756.00,Hong Kong,2024,31220,Consumer Discretionary,Consumer Electronics/Appliances
RAYA,Erayak Power Solution Group Inc. Class A Ordinary Shares,$1.3127,0.0127,0.977%,16343115.00,China,2022,399,Consumer Discretionary,Metal Fabrications
RBA,RB Global Inc. Common Stock,$101.33,1.00,0.997%,18670458327.00,Canada,,115214,Consumer Discretionary,Business Services
RBB,RBB Bancorp Common Stock,$17.58,0.00,0.00%,311050253.00,United States,2017,2533,Finance,Major Banks
RBBN,Ribbon Communications Inc. Common Stock,$4.815,-0.045,-0.926%,844472453.00,United States,,109879,Technology,EDP Services
RBC,RBC Bearings Incorporated Common Stock,$358.53,0.37,0.103%,11273705160.00,United States,2022,35636,Industrials,Metal Fabrications
RBCAA,Republic Bancorp Inc. Class A Common Stock,$67.57,0.67,1.001%,1313955274.00,United States,1998,2010,Finance,Major Banks
RBKB,Rhinebeck Bancorp Inc. Common Stock,$10.11,0.00,0.00%,112095707.00,United States,2019,84,Finance,Banks
RBLX,Roblox Corporation Class A Common Stock,$61.535,1.755,2.936%,41062304577.00,United States,2021,3488591,Technology,Computer Software: Prepackaged Software
RBOT,Vicarious Surgical Inc. Class A Common Stock,$11.61,-0.12,-1.023%,68594423.00,Hong Kong,2020,5926,Health Care,Industrial Specialties
RBRK,Rubrik Inc. Class A Common Stock,$67.13,1.29,1.959%,12435411729.00,United States,2024,241316,Technology,Computer Software: Prepackaged Software
RC,Ready Capital Corporation Common Stock,$6.9054,0.0154,0.224%,1163771923.00,United States,2013,155679,Real Estate,Real Estate Investment Trusts
RC^C,Ready Capital Corporation 6.25% Series C Cumulative Convertible Preferred Stock,$17.4999,0.00,0.00%,,United States,,50,,
RC^E,Ready Capital Corporation 6.50% Series E Cumulative Redeemable Preferred Stock,$17.8469,0.0469,0.263%,,United States,,7923,,
RCAT,Red Cat Holdings Inc. Common Stock,$6.88,0.10,1.475%,551506180.00,United States,,2181568,Technology,Computer Software: Prepackaged Software
RCB,Ready Capital Corporation 6.20% Senior Notes due 2026,$24.095,-0.005,-0.021%,4060747313.00,United States,2019,10877,Real Estate,Real Estate Investment Trusts
RCC,Ready Capital Corporation 5.75% Senior Notes due 2026,$24.54,0.02,0.082%,4135743476.00,United States,2021,400,Real Estate,Real Estate Investment Trusts
RCD,Ready Capital Corporation 9.00% Senior Notes due 2029,$25.28,0.03,0.119%,0.00,United States,2024,2537,Real Estate,Real Estate Investment Trusts
RCEL,Avita Medical Inc. Common Stock,$9.465,-0.155,-1.611%,249474135.00,United States,,13888,Health Care,Medical/Dental Instruments
RCG,RENN Fund Inc Common Stock,$2.65,-0.05,-1.852%,0.00,United States,,593,Finance,Investment Managers
RCI,Rogers Communication Inc. Common Stock,$28.05,-0.17,-0.602%,14991817442.00,Canada,,45903,Telecommunications,Cable & Other Pay Television Services
RCKT,Rocket Pharmaceuticals Inc. Common Stock,$9.64,0.12,1.261%,878754299.00,United States,2015,133006,Health Care,Biotechnology: Pharmaceutical Preparations
RCKTW,Rocket Pharmaceuticals Inc. Warrant,$0.065,0.005,8.333%,5925211.00,United States,,1800,Health Care,Biotechnology: Pharmaceutical Preparations
RCKY,Rocky Brands Inc. Common Stock,$20.52,-0.49,-2.332%,152952263.00,United States,1993,2146,Consumer Discretionary,Shoe Manufacturing
RCL,Royal Caribbean Cruises Ltd. Common Stock,$245.07,0.96,0.393%,65955383743.00,United States,1993,427022,Consumer Discretionary,Marine Transportation
RCMT,RCM Technologies Inc. Common Stock,$19.30,-0.18,-0.924%,146622640.00,United States,,12580,Consumer Discretionary,Professional Services
RCON,Recon Technology Ltd. Class A Ordinary Shares,$1.97,0.02,1.026%,29723279.00,China,2009,1227,Energy,Oilfield Services/Equipment
RCS,PIMCO Strategic Income Fund Inc.,$6.21,-0.01,-0.161%,0.00,United States,1994,23110,Finance,Investment Managers
RCUS,Arcus Biosciences Inc. Common Stock,$10.20,0.06,0.592%,1079582504.00,United States,2018,173290,Health Care,Biotechnology: Pharmaceutical Preparations
RDAC,Rising Dragon Acquisition Corp. Ordinary Shares,$10.10,0.00,0.00%,0.00,China,2024,1,,
RDCM,Radcom Ltd. Ordinary Shares,$12.255,-0.085,-0.689%,187596256.00,Israel,1997,3274,Technology,Computer peripheral equipment
RDDT,Reddit Inc. Class A Common Stock,$163.65,-4.45,-2.647%,29604996714.00,United States,2024,2252284,Technology,EDP Services
RDFN,Redfin Corporation Common Stock,$8.14,-0.24,-2.864%,1009201058.00,United States,2017,839188,Finance,Real Estate
RDHL,Redhill Biopharma Ltd. American Depositary Shares,$3.61,-0.24,-6.234%,4622746.00,Israel,,24550,Health Care,Biotechnology: Pharmaceutical Preparations
RDI,Reading International Inc Class A Common Stock,$1.52,0.08,5.556%,34087800.00,United States,,1225,Consumer Discretionary,Movies/Entertainment
RDIB,Reading International Inc Class B Common Stock,$6.86,0.00,0.00%,153843622.00,United States,,35,Consumer Discretionary,Movies/Entertainment
RDN,Radian Group Inc. Common Stock,$32.84,0.49,1.515%,4763873682.00,United States,,132587,Finance,Property-Casualty Insurers
RDNT,RadNet Inc. Common Stock,$59.78,0.45,0.758%,4425318338.00,United States,,136325,Health Care,Medical Specialities
RDUS,Radius Recycling Inc. Class A Common Stock,$13.655,0.005,0.037%,384461769.00,United States,,32750,Consumer Discretionary,Industrial Specialties
RDVT,Red Violet Inc. Common Stock ,$39.25,-0.10,-0.254%,541322341.00,United States,,36039,Technology,Computer Software: Prepackaged Software
RDW,Redwire Corporation Common Stock,$15.2344,0.7344,5.065%,1013710245.00,United States,2021,677774,Industrials,Military/Government/Technical
RDWR,Radware Ltd. Ordinary Shares,$22.94,-0.25,-1.078%,956572215.00,Israel,1999,7457,Consumer Discretionary,Business Services
RDY,Dr. Reddy's Laboratories Ltd Common Stock,$12.985,-0.055,-0.422%,10834498704.00,India,,263617,Health Care,Biotechnology: Pharmaceutical Preparations
RDZN,Roadzen Inc. Ordinary Shares,$1.07,0.01,0.943%,79384355.00,United States,2022,49275,Finance,Specialty Insurers
REAL,The RealReal Inc. Common Stock,$6.635,-0.205,-2.997%,738121244.00,United States,2019,473449,Consumer Discretionary,Other Specialty Stores
REAX,The Real Brokerage Inc. Common Shares,$5.085,-0.075,-1.453%,1005497730.00,Canada,,91186,Finance,Real Estate
REBN,Reborn Coffee Inc. Common Stock,$5.0051,0.1651,3.411%,18381550.00,United States,2022,172136,Consumer Discretionary,Restaurants
RECT,Rectitude Holdings Ltd Ordinary Shares,$4.15,0.38,10.08%,60175000.00,Singapore,2024,4913,Consumer Discretionary,Industrial Machinery/Components
REE,REE Automotive Ltd. Class A Ordinary Shares,$7.17,-0.25,-3.369%,80539391.00,Israel,,7073,Consumer Discretionary,Auto Manufacturing
REFI,Chicago Atlantic Real Estate Finance Inc. Common Stock,$16.045,0.005,0.031%,315035264.00,United States,2021,14181,Real Estate,Real Estate Investment Trusts
REFR,Research Frontiers Incorporated Common Stock,$1.3699,-0.0101,-0.732%,45916016.00,United States,,9569,Miscellaneous,Multi-Sector Companies
REG,Regency Centers Corporation Common Stock,$76.055,0.805,1.07%,13793733100.00,United States,1993,93117,Real Estate,Real Estate Investment Trusts
REGCO,Regency Centers Corporation 5.875% Series B Cumulative Redeemable Preferred Stock,$23.02,0.00,0.00%,4175027756.00,United States,,15,Real Estate,Real Estate Investment Trusts
REGCP,Regency Centers Corporation 6.25% Series A Cumulative Redeemable Preferred Stock,$23.34,0.01,0.043%,4233064632.00,United States,,536,Real Estate,Real Estate Investment Trusts
REGN,Regeneron Pharmaceuticals Inc. Common Stock,$714.34,7.40,1.047%,78094993340.00,United States,1991,124233,Health Care,Biotechnology: Pharmaceutical Preparations
REI,Ring Energy Inc. Common Stock,$1.33,0.05,3.906%,263600725.00,United States,,865301,Energy,Oil & Gas Production
REKR,Rekor Systems Inc. Common Stock,$1.315,-0.035,-2.593%,123380301.00,United States,,2522866,Telecommunications,Telecommunications Equipment
RELI,Reliance Global Group Inc. Common Stock,$1.516,-0.034,-2.194%,2596261.00,United States,,6905,Finance,Specialty Insurers
RELIW,Reliance Global Group Inc. Series A Warrants,$0.0271,-0.0029,-9.667%,46411.00,United States,,2000,Finance,Specialty Insurers
RELL,Richardson Electronics Ltd. Common Stock,$12.89,-0.28,-2.126%,185726957.00,United States,1983,5090,Technology,Electronic Components
RELX,RELX PLC PLC American Depositary Shares (Each representing One Ordinary Share),$47.79,-0.46,-0.953%,88818780574.00,United Kingdom,2015,219707,Consumer Discretionary,Business Services
RELY,Remitly Global Inc. Common Stock,$23.80,-0.04,-0.168%,4774455644.00,United States,2021,342786,Consumer Discretionary,Business Services
RENB,Renovaro Inc. Common Stock,$1.065,-0.125,-10.504%,169034147.00,United States,,1647199,Health Care,Biotechnology: Pharmaceutical Preparations
RENE,Cartesian Growth Corporation II Class A Ordinary Shares,$11.77,0.00,0.00%,0.00,United States,2022,5,Finance,Blank Checks
RENEW,Cartesian Growth Corporation II Warrant,$0.0799,0.0059,7.973%,0.00,United States,2022,18411,Finance,Blank Checks
RENT,Rent the Runway Inc. Class A Common Stock,$6.15,-0.09,-1.442%,23875622.00,United States,2021,2449,Consumer Discretionary,Other Specialty Stores
